Era Name,Time Period,Key Technologies,Architectural Patterns,Business Models,Human Role,AI Capability,Governance Approach,Example Exemplars
On-Prem Era,Pre-2010,Mainframes; Client-server; Desktop software,Monolithic architecture; Three-tier; Local databases,License-based; Perpetual; On-site deployment,Primary operator; Manual processes; Local expertise,Rule-based systems; Expert systems; Basic automation,IT governance; Compliance checklists,"Legacy ERP, Mainframe systems, Desktop applications"
Cloud Native Era,2010-2020,SaaS; IaaS; PaaS; Mobile; APIs,Microservices; Containers; Kubernetes; Service mesh,Subscription; Usage-based; Freemium,Cloud administrator; API integrator; DevOps engineer,Supervised ML; Predictive analytics; Recommendation systems,Cloud security; API governance; Data privacy,"Salesforce, AWS, Kubernetes, React, REST APIs"
Generative AI Era,2020-2024,LLMs; GPT; Diffusion models; Vector DBs,Prompt engineering; RAG; Fine-tuning; Model APIs,AI-as-a-Service; Token-based; API usage,Prompt engineer; AI curator; Human-in-the-loop,Text generation; Image generation; Code generation; Summarization,AI ethics boards; Content moderation; Model governance,"ChatGPT, Midjourney, GitHub Copilot, LangChain"
Agentic AI Era,2024-2028,Multi-agent systems; Tool use; Autonomous workflows,Agent orchestration; Multi-agent coordination; Tool chains,Outcome-based; Agent subscription; Task completion,Agent supervisor; Outcome validator; Strategic director,Goal-oriented agents; Tool use; Multi-step reasoning; Autonomous execution,Agent alignment; Outcome verification; Multi-agent coordination,"AutoGPT, LangGraph, CrewAI, Multi-agent frameworks"
BCI Era,2028+,Neural interfaces; Brain-computer interface; Neural implants,Neural-digital integration; Thought-to-action; Direct neural feedback,Neural subscription; Thought-based; Intention-driven,Neural operator; Thought integrator; Cognitive augmenter,Direct neural feedback; Thought-to-action; Cognitive enhancement; Seamless integration,Neural ethics; Cognitive rights; Neural privacy; Brain data governance,"Neuralink concepts, Neural prosthetics, Brain-to-computer translation"