id,initiative,description,status
1,Update visual organ map,"Five eras overlay and lobe flows",Backlog
2,One-pagers per thinker,"Profile with prompts and usage",Backlog
3,Policy as code pack,"Context integrity + overrides",Backlog
4,Agent safety harness,"Recorder + kill switch",Backlog
5,Neural consent vault,"Model + API",Backlog
6,Workshop deck,"Half-day with role-based cases",Backlog
7,Live metrics dashboard,"Surprise index + safety",Backlog
8,Microsite search,"Across thinkers and lobes",Backlog
